{
  "id": "F-0001",
  "rule_id": "r",
  "cls": "sqli",
  "status": "raw",
  "severity": "high",
  "file": "app.py",
  "line": 18,
  "message": "m",
  "dataflow": [],
  "risk_score": null,
  "verification": null,
  "patch_diff": null,
  "discovery_sha": null,
  "duplicate_of": null,
  "history": [],
  "fingerprint": null,
  "priority": null,
  "cvss_vector": null,
  "evidence": "",
  "evidence_sources": [],
  "asvs_ids": [],
  "codeguard_ids": [],
  "completeness_tier": null,
  "runtime_disposition": null,
  "runtime_test": null,
  "preconditions": [],
  "reachability": null,
  "judge_verdict": null
}